ar	en	ar
ar	Hi, "10 billion won" radar.	مرحباً، يا رادار الـ 10 مليار وون
ar	We need to run the radar.	يجب أن نقوم بتشغيل الرادار
ar	You... were you harassed all night?	...أنتِ هل تمَتّ مضايقتكِ طوال الليل؟
ar	Your dark circles are about to bury deep into the ground!	! هالاتُـكِ السوداء على وشك أن تُدفن تحت عُمق الأرض
ar	The supermarket granny came, so I couldn't sleep all night.	الجدّة صاحبة محل البقالة جاءت، لذا لم أستطع النوم طوال الليل
ar	Mr. CEO, do I...	سيّدي الرئيس هل أنا...
ar	look sick?	أبدو مريضة؟
ar	You... always look sick.	أنتِ... دائماً تبدين مريضة
ar	But today, more than usual... you look like a zombie.	...ولكن، اليوم أكثر من العادة تبدين مثل الزومبي
ar	He says that when he hasn't seen a zombie in real life.	يقول هذا و هو لم يرى زومبي في حياته
ar	Instead of a zombie, you said you have seen a water ghost, right?	بدلاً من الزومبي، أنتِ قُـلتِ أنكِ رأيتي شبح مياه أليس كذلك؟
ar	A long time ago, when I went to the Han River with my sister to eat chicken...	منذ وقت طويل عندما كنت على نهر الــ "هان" مع أختي ...نـأكل الدجاج
ar	I was enchanted by a water ghost, and I almost drowned to death!	لقد سحَرني شبح مياه و كنت على وشك ! الغرق
ar	Water ghost!	! شبح ماء
ar	I never want to see a water ghost again.	! أنا لا أريد أن أرى شبح مياه مرّةً أخرى، أبداً، أبداً
ar	Never, ever!	!
ar	I really hate water ghosts!	أنا أكرهُ أشباح الماء!
ar	I hate them so much!	أنا أكرههُم كثيراً !
ar	They're too scary!	إنهم مخيفين جداً
ar	Hold it.	إمسِكي يدي
ar	With water ghosts, it doesn't help to hold your hand.	بوجود أشباح المياه، لا يساعد الإمساك بيدك
ar	Water ghosts.	أشباح الماء
ar	She shudders at the thought of them.	إنها ترتعدُ خوفاً من التفكير بهم
ar	I feel bad just sending her to catch them.	أنا أشعُر بالسوء من إرسالها للإمساك بهم
ar	Mr. CEO gave this, saying you should visit on your day off.	الرئيس أعطاكِ هذه، قائلاً أنكِ يجب أن تذهبي في يوم الإجازة
ar	Gift certificate to an all-inclusive package at Kingdom Hotel!	! شهادة هدية لجميع مَن فِـي فندق المملكة
ar	Isn't this place a really awesome place?	أليس هذا المكان مُذهل حقاً؟
ar	He included several gift cards, saying you should have a good time with your friends.	،لقد وضع العديد من بطاقات الهدايا قائلاً أنكِ يجب أن تقضي وقت جيّد مع أصدقائكِ
ar	Earlier, he said I looked like a zombie...	...قبل قليل قال أنني أبدو مثل الزومبي
ar	Is he sending me there so I can get some rest?	هل يرسلني هناك لأحصل على بعض الراحة؟
ar	Oh, I'm so happy!	! آوه، أنا سعيدة جداً
ar	I passed it along. She was really happy about it, and she says she'll go tomorrow.	لقد أعطيتُـها إيّـاه، وكانت سعيدة جداً بهِ وقالت أنها سوف تذهب غداً
ar	I'll send her over there first, then later... I'll tell her to see the ghost.	...سوف أُرسِـلُها هناك أولاً ثم بعد ذلك أُرسِـلُها لترى الشبح
ar	If it's Kingdom Hotel, it will be really luxurious. What's the occasion?	.إذا كان فندق المملكة، فبالتأكيد هو فخم ما المناسبة؟
ar	I have more, so if you want to bring friends, do that..	...لديّ الكثير، لذا إذا أردتي أن تُـحضِري أصدقاء، إفعلي هذا
ar	- Then... should we ask Apt. 404?	إذاً... هل نطلب من الشقة 404؟
ar	Well, then let's just pack our suitcase.	حسناً، إذاً لنقوم بحزم أمتعتنا
ar	Pack a lot of pretty clothes, since we can load them in my car.	إحْزِمِي الكثير من الملابس الجميلة، بما أننا يُـمكننا أن نضعها في سيارتي
ar	Okay. Unnie, I'll take a lot of pretty pictures for you.	حسناً آوني، سوف ألتقط العديد من الصور الجميلة لكِ
ar	Gong Shil, I'm so happy.	جونج شيل"، أنا سعيدة جداً"
ar	Hey, Kingdom Hotel has a pool, right?	هيي، هناك حمام سباحة في فندق المملكة، صحيح؟
ar	Let's pack our swimsuits as well.	لنقوم بحزم ملابس البحر أيضاً
ar	Don't you get the chills, with rumors saying there's something in the pool?	ألا تشعر بالقشعريرة، بسبب الشائعات التي تقول أنهُ هناك شيء في حمام السباحة؟
ar	There is no such thing!	"ليس هناك شيء هكذا!
ar	It isn't like this is the Loch Ness. (Lake in Scotland where the Loch Ness Monster "lives")	إنها ليست "لوتش نيس "بُـحيرة يقال أنهُ يعيش بها وحش اللوتش نيس"
ar	You dared to ask me to come and see you?	أنت تجرّأت على أن تطلب مني المجيئ لرؤيتك
ar	I'm not a person you can easily meet, on a whim.	أنا لستُ شخص يُـمكنك رؤيته بسهولة، على هَـواك
ar	Thanks for coming in your busy schedule.	شكراً على مجيئكِ بالرغم من أنه لديكِ أعمال عديدة
ar	What is it that you wanted to ask me?	ماذا تريد أن تسألني؟
ar	Please find out details on Tae Gong Shil, things that can't be found in official records.	من فضلكِ، إبحثي عن أشياء تخص "تاي جونج شيل"، أشياء لا يُمكن إيجادها في السجلات
ar	If you find out through her friends, you'll know whether they have seen her dead parents, and what her relationship was like with her parents, right?	،إذا عرفتي مَن صديقاتها ،سوف تعرفي إذا كانوا رآو والديها وكيف كانت علاقتها معاهم، صحيح؟
ar	Why do you want to know about her family?	لماذا تُـريد أن تعرف أمور عائلتها؟
ar	If I was going to marry her, I wouldn't be doing a background check like this.	إذا كنت سأتزوجها، لم أكُن لأقوم بعمل بحث عنها !
ar	I could just meet her family in person!	كنت لأقابل عائلتها شخصياً
ar	Oh, that's right.	آوه، هذا صحيح
ar	Then... is this just part of your job?	إذاً... هل هذا جزء من عملك؟
ar	Keeping your eyes on her?	مراقبتها؟
ar	If that's the case, then I'll help you. Let's talk while we eat something.	.إذا كان الأمرُ كذلك، فسوف أساعدك لنتحدث بينما نأكل شيء ما
ar	Are you going to help, only if I dine with you?	هل ستُساعديني فقط إذا أكلتُ معكِ؟
ar	No, I don't mean that.	لا، أنا لم أعني هذا
ar	I'm just saying it's meal time, so I'll "let" you join me.	أنا أقول فقط أنها وجبة، لذا سوف "أدعُـك" تُـشاركني بها
ar	If that's the case, then you don't have to "let" me join you.	"إذا كان الأمر هكذا، فليس عليكِ أن "تدعيني أشاركُـكِ بها
ar	Call me after you've found out something.	إتّصلي بي بعدما تعرفي شيء
ar	I already made reservations...	...لقد قمت بحجز بالفعل
ar	Why is he playing so hard to get, when he's just a "salaryman"?	لماذا يلعب دور صعب المنال بينما هو فقط موظف"؟"
ar	Secretary Kim, are you reporting to my father about me?	،"أيها السكرتير "كيم هل أنت تقوم بإبلاغ أبي عني؟
ar	I met him last year, and after he went overseas, we've never talked on the phone.	لقد قابلتهُ السنة الماضية، و بعدما سافر لم نتحدث على الهاتف
ar	Considering how he never showed interest in women with whom there were talks of marriage, it's strange that he would suddenly show interest in Tae Gong Shil.	بالنظر في أنّـهُ لم يهتم أبداً بالنساء اللواتي كُنّ ،في حديث الزواج "من الغريب أن يهتم فجأة بـِــ "تاي جونج شيل
ar	I'm sure he's doing it out of love.	أنا متأكد أنهُ يفعل هذا بدافع الحب
ar	That... is even more ridiculous.	...هذا أكثر سخرية
ar	Did Tae Gong Shil leave?	هل غادرت "تاي جونج شيل"؟
ar	Unnie, this place is awesome!	آوني، هذا المكان مُذهل !
ar	Get here quickly!	تعالي هنا بسرعة
ar	I'll pack my stuff and go when I'm done with work. You take a look around first.	.سوف أحزم أمتعتي و أذهب بعد العمل لذا، ألقِي نظرة حول المكان
ar	Where are you going? Looks like it's somewhere nice.	إلى أين أنتِ ذاهبة، يبدو أنهُ مكان جميل
ar	You don't need to know.	ليس عليكِ أن تعرفي
ar	I'm a career woman!	أنا موظفة!
ar	Why do I have to spy on Tae Gong Shil?	لماذا عليّ أن أكون جاسوسة على "تاي جونج شيل"؟
ar	I got something like this.	لقد حصلت على شيء كهذا
ar	Bring Kang Woo and come.	أَحْضِر "كانغ وو" و تَـعال
ar	You want us to join on Tae sisters' trip?	أتُريدُنا أن ننضم لحفلة الأخوات "تاي"؟
ar	I, with Gong Shil and Kang Woo... want to do this.	..."أنا، "جونج شيل" و "كانغ وو نُـريد فِـعل هذا
ar	If they get together, I'll buy you food.	إذا جعلتهم معاً، سوف أشتري لك الطعام
ar	Should I report this to the Vice President?	هل عليّ أن أقول هذا لنائب الرئيس؟
ar	Let's just go have fun. We have to.	لنستمتع فقط، يجبُ علينا هذا
ar	Maybe it's because it's wide open, but this place doesn't seem scary.	ربما لأنهُ مفتوح، ولكن هذا المكان لا يبدو مُخيف
ar	They're doing fireworks today.	هناك ألعاب نارية اليوم
ar	Fireworks can't happen during the day and I'm scared to go out at night.	الألعاب النارية لا يُمكن أن يتم عملها بالنهار وأنا أخاف الخروج في الليل
ar	It's a pie in the sky for me.	إنها فطيرة في السماء بالنسبة لي
ar	Mr. CEO?	سيّدي الرئيس؟
ar	I'm at the hotel lobby. This place is really nice.	أنا في رِواق الفندق، هذا المكان جميل فعلاً
ar	Of course, it is. It's mine after all.	بالطبع هو كذلك، إنهُ مِـلْكِي على كُـل حال
ar	The painting next to you is also really expensive.	اللوحة الفنية التي بجانبكِ غالية الثمن جداً
ar	Mm, it does look expensive.	آمممم، تبدو غالية
ar	Oh, but how do you know where I am?	آوه، ولكن كيف تعرفُ أين أنا؟
ar	Because I'm behind you.	لأنني خلفكِ
ar	Mr. CEO!	! سيّدي الرئيس
ar	- I followed you.	- لقد تَـبعتُـكِ-
ar	Did you come alone?	هل جئتي وحدكِ؟
ar	My sister hasn't come yet...	...أختي لم تأتي بعد
ar	Let's go eat first.	لنأكل أولاً.
ar	He followed me?	لقد تَـبِـعَنِي؟
ar	You have it ready, right?	أنت جهزتـهُ، أليس كذلك؟
ar	Yes. After dinnertime, the pool will be off limits to outsiders.	نعم، بعد وقت العشاء سوف يتم منع حمام السباحة عن الآخرين
ar	We can go after we eat dinner.	يمكننا الذهاب بعد آكل العشاء
ar	I'll tell you after we eat.	سوف أُخبركِ بعدما نأكل
ar	It looks like Master Joo is doing an event for that girl.	يبدو أنّ السيد "جو" سيقوم بِــ حَـدث لهذه الفتاة
ar	She's so lucky!	إنها محظوظة جداً!
ar	She'll get to watch the fireworks at the closed off pool.	سوف ترى الألعاب النارية في حمام السباحة المُغلق لهما فحسب
ar	Do you have anything you want to eat?	هل تريدي أن تأكلي شيء ما؟
ar	Tell me, I'll buy it all for you.	أخْـبرينِي و سوف أشتريه لكِ
ar	Are you going to buy me something good because I look out of energy?	هل ستشتري طعام لي لأنني أبدو فاقدة لطاقتي؟
ar	Then, buy everything I want please.	إذاً، إشْـتَرِي كل ما أريد، من فضلك
ar	It's been 15 years since Hee Joo died.	لقد ماتت "هي جو" من 15 عام
ar	Every year, for remembering and helping the place where she grew up, thank you very much.	شكراً لكِ كثيراً على تذكّـركِ و مساعدتكِ للمكان الذي تربَّـت بهِ
ar	It's already been 15 years since Cha Hee Joo died.	لقد ماتت من 15 عام بالفعل
ar	After she died, I thought about ending my relationship with this place because it felt like I was paying for her life.	بعدما تُـوفِيّت، لقد فكرتُ بأن أنهي علاقتي مع هذا المكان لأنني شعرت وكأنني أدفع ثمن حياتها
ar	But thinking of Joong Won, I think I did well by continuing to come here.	ولكن، بالتفكير في "جونغ وون"، أعتقد أنّني فعلت شيء جيّد بإستمراري في المجيئ هنا
ar	It was here where Joo Goon met Cha Hee Joo for the first time, right?	لقد كان هنا أول مرة قابل "جونغ وون" "تشا جي هو"، أليس كذلك؟
ar	Chief Kang Woo?	رئيس الحرس، "كانغ وو"؟
ar	Why did he come here?	لماذا أتى هنا؟
ar	Secretary Kim, what are you doing?	أيها السكرتير "كيم"، ماذا تفعل؟
ar	Ah, yes. I'm going.	آه، نعم، أنا آتي
ar	Tae Gong Ri, Tae Gong Shil...	..."تاي جونج ري"، "تاي جونج شيل"
ar	Such sisters have never been at this orphanage.	لم يكُن هناك أُختَـان بهذا الإسم في الملجأ
ar	You didn't even bring Kang Woo, so why are you still coming?	أنت لم تُحضر حتى "كانغ وو"، لذا لماذا أتيت؟
ar	Chief Kang Woo has other business, and I don't ever drop out of something I decide to join.	،كانغ وو" لديهِ أعمال أخرى" و أنا لا أتراجع عن شيء قَـرّرتُ أن أنضم لهُ
ar	You couldn't even bring money for gas.	أنت لم تُحضر مال حتى للبنزين
ar	Han Joo has small salary.	هان جو" لديهِ مُـرتّـب قليل"
ar	It's Kim Dong Soo. - Do you know him?	"إنهُ "كيم دونغ سو- هل تعرفيهِ؟
ar	Oh!	! آوه!
ar	It's the same!	إنها مثل هذه
ar	Who is he?	مَـن هُـو؟
ar	He was the one who ran away with my money and disappeared.	إنهُ الشخص الذي هرب بِــ مَـالي و إختفى
ar	It's my neck.	...رقَـبتي، ولكن
ar	But... are you following him?	هل سَتتبعِيه؟
ar	You can't. We have somewhere else we need to go. - Shut up!	هناك مكان علينا الذهاب إليهِ- إخرس-
ar	Hold on tightly.	تمسّك جيداً
ar	You can't have alcohol, so at least have this.	أنتِ لا يمكنكِ شرب الكحول، لذا على الأقل إشربي هذا
ar	Now that you're resting at a nice place, your dark circles have gotten better.	،الآن بما أنكِ تستريحي بمكان جيّد الهالات السوداء تختفي، هذا شيءٌ جميل
ar	But, by any chance... do you have any other clothes?	ولكن، بالمناسبة... هل لديكِ ملابس أخرى؟
ar	My sister's bringing all my clothes, but she's running a bit late...	...أختي معها كل الملابس، ولكنها تأخّرت
ar	If she's going to go in and out of the pool, she'll need a change of clothes...	إذا كانت ستدخل و تخرج من الماء، فسوف تحتاج ...لتغيير ملابسها
ar	Should I prepare it?	هل أقوم بتحضيرها؟
ar	Hey, tonight President Joo is closing the pool and doing an event.	هاي، الرئيس سوف يُغلق حمام السباحة الليلة و يقوم بعمل حدث خاص
ar	Wow, whoever girl it's for is so lucky.	واو، أيّ فتاة لها هذا محظوظة جداً
ar	It's our loss when we get jealous. - I wish I can go on a date with him just once.	إنها خسارتنا عندما نشعر بالغيرة- أتمنى أن أذهب في موعد غرامي معهُ مرّةً واحدة-
ar	Event?	حدثٌ؟
ar	For me possibly?	من الممكن أن يكون لي؟
ar	You're going to go to your room, right?	أنتِ ستذهبي إلى غرفتكِ، أليس كذلك؟
ar	Meet me in two hours at the lobby.	(قَـابلِيني بعد ساعتان في الرُدهة (بهوُ الفندق
ar	We already ate. Is there something else?	لقد أكلنا بالفعل، هل سنقوم بشيء آخر؟
ar	There's something very important.	هناك شيء هام جداً
ar	If by chance you get surprised, don't get too mad.	إذا تفاجئتِ، لا تكوني غاضبة جداً
ar	Mr. CEO rented the swimming pool, and the one that he wants to meet in two hours is me.	،الرئيس إقترض حمام السباحة و التي يريد مقابلتها بعد ساعتان هي أنا
ar	Then, he closed the pool because of me?	إذاً، هل أغلق حمام السباحة بسببي؟
ar	Don't let anyone else enter after I go in.	لا تَـدع شخص آخر يدخل بعدما أدخل أنا
ar	Have the prepared item sent to the guest room I told you about.	هل الأشياء التي جهزتها تمّ إرسالها لغرفة النّزلآء التي قُـلتُ لك عليها؟
ar	What... is this?	ما... هذا؟
ar	CEO Joo sent this.	الرئيس أرسَلها
ar	It's so pretty!	! إنّـهُ جميل جداً
ar	It's pretty!	! هذا جميل
ar	Then, what Mr. CEO said about an important matter...	إذاً، ما قال الرئيس أنهُ ...شيء مهم هو
ar	Did you prepare this for me?	هل جهزت هذا لي؟
ar	Yes. There's more.	نعم، و هناك المزيد
ar	Look.	أُنـظُري
ar	♫ It's you	إنّـهُ أنت
ar	♫ Love that's like destiny	حُـبّ مثل القَـدر
ar	♫ Sad memories that were like shadows	الذّكريات الحزينة التي كانت مثل الظِّـل
ar	Please go in. Mr. CEO has been waiting for you.	أُدخُـلي من فضلكِ الرئيس ينتظرُكِ
ar	Is no one really allowed to go in because it's closed off?	هل غير مسموح بدخول أيّ شخص لأنّـهُ مُغلق حقاً؟
ar	Yes, he has ordered not to let anybody in except you two.	نعم، لقد أَمَـر بأن لا يدخل شخص آخر غيركما
ar	[Oh, okay.] I came here because a problem came up at the hotel's pool. I didn't come to play.	[آوه، حسناً]
ar	I'll return after figuring out what it is in the pool.	سوف أعود بعدما أعرفُ ما بالحمام
ar	Hello, 10 billion dollar radar. You're going to have to use your radar again.	مرحباً، يا رادار الـ 10 مليار وون، سوف تستخدمي الرادار مرّةً أخرى
ar	You said you've seen a water ghost before, right?	أنتِ قلتِ أنكِ رأيتي شبح ماء من قبل، صحيح؟
ar	Tae Gong Shil!	!"تاي جونج شيل"" تاي جونج شيل"!
ar	Tae Gong Shil, where are you going?	إلى أين أنتِ ذاهبة؟"
ar	♫ When you brush by,	عندما تُلامس أصابعي
ar	♫ My heart that once was cold	قلبي الذي كان بارد
ar	♫ Spreads with warmth	أصبح دافئاً
ar	That could have been bad. I would have been so embarrassed.	كان هذا ليكون سيئ، كُـنت لأكون في غاية الإحراج
ar	It would have been a disaster if I went, dressed like that.	.كان الأمر ليكون كارثة إذا كُـنتُ ذهبتُ هكذا بهذه الملابس
ar	♫ I want to quietly approach	أنا أريد أن أقترب بهدوء
ar	♫ And just lean on you	و أتكِـئٌ عليك
ar	But then, why am I so upset?	،ولكن لماذا أنا متضايقة جداً؟
ar	♫ The distance doesn't get closer.	المسافات لا تقترب
ar	When your heart doesn't tell you the truth, your symptoms will give you the answer.	،عندما لا يقول قلبكِ الحقيقة فإن الألم سوف يَـقُولها
ar	♫ It's okay if I can't touch you	لا بأس إذا كان لا يُـمكنني لمسك
ar	♫ It's okay if I can't embrace you	لا بأس، إذا كنتُ لا أستطيع إحتضانك
ar	♫ Lonely love, yes I love you as if you're my destiny.	حُـبٌّ وحيد، نعم، أنا أُحِـبّـك كما لو كُـنت قَـدرِي
ar	♫ I can feel you	يُـمكنني أن أشعر بك
ar	♫ La la la la la la la	لا لا لا لا لا لا لا
ar	Is there anything else you need?	هل هناك شيء آخر تُـريدهُ؟
ar	Flowers, champagne, I'll prepare everything.	ورود، شمبانيا، سوف أُجَـهِّز كُــلّ شيء
ar	It seems she's mistaken about something.	يبدو أنّــها أخطأت بشأن شيء ما
ar	Looks like she got kicked out after going in there in a fancy dress.	يبدو أنّـه تَـمّ طردها بعد دخولها هناك وهي مُرتدية فستان فخم
ar	Looks like it's not an event.	لا يبدو أنّـهُ حدث خاص
ar	You changed.	أنتِ غَـيّرتِي ملابسكِ
ar	Yes, I thought it would be uncomfortable.	نعم، لقد إعتقدتُ أنهُ سيكون غير مريح
ar	You looked pretty earlier. Let's go.	لقد كنتِ جميلة وقتها، لنذهب
ar	There isn't anything scary here.	ليس هناك شيء مُخيف هنا
ar	There are people who are scarier than ghosts.	هناك أشخاص مُـخيفين أكثر من الأشباح
ar	Right now, in their eyes, we look like "What do they think they're doing?".	."الآن، في أعيُـنهم يبدون مثل "ماذا يعتقدوا أنهما يفعلان؟
ar	It can't be that way.	.لا يُمكن أن يكون الأمر هكذا
ar	I don't care what they think.	لا يهُـمّني ما يعتقدوا
ar	I'm looking at you, who is upset by what those people are saying.	،أنا أنظر لكِ أنتِ التي مُـتضايقة مِمّـا يَـقُولون
ar	Tae Gong Shil. You're upset, aren't you?	تاي جونج شيل"، أنتِ متضايقة، أليس كذلك؟"
ar	Running away dressed like that back there; you looked like Candy.	،جَـريُـكِ هكذا قبل قليل و أنتِ مُرتدية هذا .كنتِ تبدين كـ حلوى
ar	Think about it. You invite me here, buy me dinner, send me clothes.	فَـكِّر بالأمر، أنت دعَـوتَـنِي هنا و إشتريت لي طعام و أحضرت لي ملابس
ar	Of course, I'd turn into Candy.	بالطبع، سوف أتحوّل لِــ حلوى
ar	You should have just told me to use my radar. Why did you do that?	.كان يجب أن تُـخبرني فقط أن أستعمل الرّادار لماذا فَـعلت هذا؟
ar	You said you were scared. I'm still your secret hideout.	.أنتِ قلتي أنكِ خائفة أنا مازلتُ ملاذكِ السِرّي
ar	Forcing you when you said you didn't want to.	أن أُجبركِ و أنتِ قلتي أنكِ لا تُـريدي
ar	I felt guilty.	لقد شعرت بالذنب
ar	So, it's like that.	لذا، الأمر هكذا
ar	I feel a little bit better now.	أنا أشعر أفضل قليلاً الآن
ar	Let's go catch that water ghost.	لنذهب للقبض على شبح الماء
ar	It's okay now, Mr. CEO.	لا بأس الآن، سيدي الرئيس
ar	Let my hand go, if you can.	دَع يَـدِي، إذا كنت تستطيع
ar	I don't care.	لا يهُـمّني
ar	I think those people are expecting a Candy who has been abandoned by her lover, but I don't want to become that Candy.	أعتقدُ أنّ هؤلاء الناس يتوقعوا "حلوى" هَـجرها حبيبها
ar	Let's go.	.ولكنني لا أريد أن أكون هذه الحلوى لنذهب
ar	I've asked Gong Shil's closest friends.	."لقد سألتُ أقرب أصدقاء "تاي جونج شيل
ar	Her parents are her biological parents. They said they were all very close, too.	.والديها، هما والدبها الحقيقيين لقد قالوا أنهم كانوا مُـقرّبين أيضاً
ar	I even recorded it. Should I give it to you?	لقد قُـمت بتسجيله، هل أُعطِـيه لك؟
ar	Send it to me. Thanks a lot.	إرسليه لي، شكراً لكِ
ar	Doing this, we really seem like spies. I've always wanted to be one.	.بفعلنا هذا، نبدو حقاً مثل الجواسيس لقد أردتُ دائماً أن أكون واحدة
ar	Aren't you a singer?	ألسْتِ مُـطربة؟
ar	I've done a movie, too, you know. Haven't you done any research on me?	لقد مَـثّـلتُ بفيلم أيضاً، ألم تبحث عني؟
ar	You can find it all on the internet...	...يمكنك إيجادهُ بالأنترنت
ar	How long are you going to follow me?	إلى متى ستُـواصلي تَـتبُّــعِي؟
ar	Salary man, you don't have a car, right?	أيها الموظف، أنت ليس لديك سيارة، أليس كذلك؟
