ar	en	ar
ar	Shall we?	هل أفعلُ هذا؟
ar	I think that the way my nephew looks at you... is different from the way he looks at other girls.	أعتقد أن إبن أخي ينظر إليكِ بطريقة مختلفة عن باقي السيدات
ar	How do you feel about him?	ماذا تشعري "هان نا"؟
ar	I'm interested in him as well.	أنا أيضاً أشعر بالإنجذاب تجاههُ
ar	Then may I be direct and ask you about something that's been concerning me?	إذاً، هل يمكنني أن أسأل عن شيء يُـزعجني؟
ar	That woman, Tae Gong Shil... what was her relationship with Joo Joong Won?	الفتاة التي تُدعى "تاي جونج شيل ماذا كانت علاقتها بالرئيس؟
ar	The truth is, she was pretty close with Joong Won.	صراحة، لقد كانت مُـقربة جداً منهُ
ar	She talked about helping him heal a scar that some dead girl left and she attached herself to Joong Won's side.	لقد تمسّكَت بهِ بعد إعادة فتح جراحهُ
ar	Hee Joo, I assume?	أتعني "هي جو"؟
ar	- Did Tae Gong Shil know the late Hee Joo?	،"تاي جونج شيل تعرفُ الميتة "هي جو"؟
ar	- There's no way that she could.	مستحيل
ar	She said some nonsense about calling Hee Joo's ghost to heal his scars or something.	...لكن لقد قالت شيء عن أنها تريد الإتصال بِـــ الميتة "هي جو" و أن تُـشفي جراحهُ
ar	She's a woman who goes around talking about absolute nonsense.	إنها تتحدث بكلام لا معنى لهُ
ar	Yes, I see.	هذا صحيح
ar	Calling forth a dead person's ghost?	...تتصّل بشخص ميت
ar	That really is all nonsense.	إنها تتحدث عن شيء غير منطقي
ar	Shall we go?	لنذهب
ar	Are you... asking me to give you my body right now?	،الآن هل تُـريديني أن أقرضكِ جسدي؟
ar	Can't I just relay the message to him for you?	هل هو شيء لا يمكنني إخبارهم بهِ؟
ar	Then... will you be able to catch the culprit?	...إذاً هل يمكنكِ أن تعرفي المُجرم؟
ar	'One stormy night'...	في ليلة حدُوث العاصفة
ar	Are you... my sun?	هل أنتِ
ar	Episode 14.	الحلقة الـ 14
ar	Are you... my sun?	هل أنتِ تاي يانج ؟
ar	How did you know to come here when you don't even remember who I am?	كيف جئت إلي هنا ؟ بالرغم إنك لا تتذكرني
ar	I don't know who you are.	. أنا لا أعرف من أنتِ
ar	I just get the feeling that you were someone very important to me.	. لكن أعتقد إنكِ شخص مهم لي بطريقة ما
ar	Who are you to me?	من أنتِ لي ؟
ar	You seem to have come here with a high expectation for something.	. يبدو إنك كنت تتوقع شيء مميز
ar	But don't think too much of it, and take this for what it is.	. فقط فكر ... ........ كما يبدو لك
ar	I'm just a penniless woman.	. أنا فتاة فقيرة و مفلسة
ar	And you are the great president of the company that I used work at.	و أنت عندك الكثير من المال يا رئيس
ar	So, what could I possibly be to you?	إذاً ماذا أكون لك ؟
ar	I heard that you went around telling everyone that I was a special person to you?	إنكِ شخص مميز لي
ar	How, and in what way am I special to you?	كيف أنتِ مميزة لي ؟
ar	I hitched a ride in your car one night.	ركبت معك السيارة
ar	Then I found out that you were the president of Kingdom.	. و أخبرتني إنك رئيس المملكة
ar	I knew that I have to get my hands on you. So, I got a job there and chased you around.	و أصبحت أتجول هناك
ar	I told you that I was sad and lonely, so you took pity on me and started seeing me.	بعدما رأيت كم أبدو حزينة و يائسة . بدأت أن تهتم بي
ar	You helped me when I needed help, and you gave me a job. You even held a special event for me at your hotel.	. أنت أعطيتني عمل و أيضاً قمت بـ دعوتي لـ حدث خاص بالفندق
ar	That's how you became a special person to me.	. و أصبحت شخص مميز للغايه لي
ar	You're telling me that I kept someone like you around me?	أنا تركت شخص مثلكِ يبقي بجانبي ؟
ar	There's no way I would've done that.	. غير معقول
ar	By any chance, is this building yours?	ربما ؟
ar	You once told me you'd buy me a house, and a car because you didn't want to see me living in a place like this.	أنت أخبرتني أنه لا يجب أن أعيش بمنزل مثل هذا . و أنت ستشتري لي منزلاً و سيارة
ar	I find your jokes to be very offensive.	. هذه حقاً مزحة غير مضحكة
ar	This will imply that you're a candy girl living in this dump and I'm just a pushover that you took advantage of. I've been spending all my time with a woman who apparently isn't even that exciting? Me?	و أنا الغني الذي يشفق عليكِ . لدي حاسة سادسة مميزة
ar	I can't see how you can stir up any inkling of desire from me whatsoever.	من المستحيل أن تكون تلك الحاسة مميزة لـ هذه الدرجة
ar	But I did.	. إنها مميزة
ar	I hadn't planned on going away so easily after all my work hard.	لقد تمسكت بك بقوة . وكنت أفكر ألا أدعك بسهولة
ar	But you got hurt while you were with me. I felt bad about what happened... so I've decided to just walk away from you.	و فكرت في أبعادك عني
ar	I'll consider the money you deposited into my bank account as a payoff.	. و أنت أرسلت لي الكثير من الأموال إلي حسابي بالبنك
ar	I'll just keep it for myself.	سأستخدمه جيداً
ar	Thanks for everything.	. أنا ممتنة لك
ar	Goodbye.	عليك الذهاب
ar	Is that really everything?	هل هذه الحقيقة حقاً ؟
ar	Fine, if we were that physically intimate, then let me hold you again.	حسناً أذا كنا في هذا النوع من العلاقة سأحاول التمسك بكِ مجدداً
ar	Then I may get my answer as to what it is that you meant to me.	و بعدها ستظهر الإجابة و سأعرف من أنتِ حقاً ؟
ar	Don't touch me. I told you that it's over.	لا تضع يديك علي . أخبرتك أنها أنتهت
ar	In this situation, I'm the one who gets to decide when it's over, not you. What?	في هذا النوع من العلاقات . ليس أنتِ من يقرر متي سوف تنتهي
ar	You came after me, so I kept you around?	ماذا ؟ هل أعطيتني بعض الصمغ حتي ألتصق بكِ ؟
ar	It won't take me long to see how much you were worth to me when I look into my bank account.	و كل شيء كان مجرد أموال تأخذيها مني
ar	But... I know that this isn't everything.	. لكن أنا أعتقد إن هذا ليس كل شيء
ar	Many things have changed during the time that I can't remember.	♪ بها الكثير من الأشياء التي تغيرت
ar	I feel flustered... but I don't dislike it.	لكني لا امانع
ar	Could it be that... you're the cause of all that change?	هل كان بسببكِ ؟
ar	I feel like I've lost something enormously important to me.	♪فقطالوحيدفيهذاالعالملي♪ . أعتقد أني نسيت شيء كبير
ar	Is what I've lost... in your possession?	هل هذا ... ..
ar	You did leave something here.	. هناك شيء تركته هنا
ar	Wait out here. I'll go and give it back to you.	أنتظر دقيقة سأعيده لك
ar	I'll leave my beer here.	♪أنتتجعلنيأبكي♪ . لـ أضع عندكِ تلك البيرة
ar	See? Now there's plenty of room.	هناك مكان لها
ar	This is all you left here during our time together.	. هذا كل ما تركته هنا
ar	You asked me to be the kind of woman whom you can easily leave.	. لقد طلبت مني أكون فتاة تستطيع الرحيل بسهولة
ar	That's exactly what I'm doing, so please go away now.	لذا أرجوك أرحل
ar	Did I... drink things like this here? Is that how we spent our time with you?	هل أنا حقاً شربت هذه و بقيت معكِ هنا ؟
ar	Okay. If this is all it was, then I don't need to hear anymore.	أعتقد إنه لا بأس
ar	For going away so easily...	علي أنك تستطيعي أبعاد نفسكِ عني
ar	and for returning what's mine back to me.	. و علي أعادة أشيائي
ar	Don't ever come here again.	. لا تعد مجدداً
ar	She said her name is Tae Gong Shil.	أسمها تاي جونج سيل
ar	You know her, don't you?	أليس كذلك ؟
ar	Do you... remembered who she is?	هل تسألني لأنك تذكرت ؟
ar	My memories are gone... and Chief Secretary Kim is on personal leave and has gone off radar.	لا أتذكر مطلقاً و بسبب أن . السكرتير كيم حالياً في أجازته
ar	So, I need you to report to me what memories I'm still missing since you're always watching me like a hawk.	سأحاول أن أتذكرها من خلالك
ar	Was I, open and blatant about my relationship with that woman?	هل أنا و تلك الفتاة كنا نتواعد ؟
ar	The rumors of the relationship between you two were all over the place and everyone was talking about you two. So, I'll just relay the stories that I've heard from others.	سأخبرك الأشاعات التي أنتشرت كثيراً . و القصة التي سمعت الناس تتحدث عنها في كل مكان
ar	But you were pretty far gone.	يا رئيس جو
ar	In the beginning, I think you were only thinking of her on a casual term.	أنك فكرت في الأمر بشكل عادي
ar	We've only agreed to a meaningless physical relationship.	. نحن الإثنان أتفقنا بأن يكون بيننا بعض الإتصال الجسدي فقط لا أكثر
ar	A sense of desire unlike that of anyone else.	. لديها حاسة مميزة
ar	That's what I fell for?	. هذا ما جعلني أبقي معها
ar	You're not the type to usually care about what others think.	. أنت لست من النوع الذي يهتم بـ آراء الآخرين
ar	You remained true to your form, and took her around with you everywhere.	و تصرفت علي طبيعتك
ar	- You're lying, aren't you?	صحيح ؟
ar	- No, I'm serious.	هذا صحيح
ar	What else?	أذاً ؟
ar	There was even a talk of marriage with the heiress from Sejin Group... but you told everyone that you couldn't break up with her.	. كان هناك كلام عن أنك ستتزوج من أبنة مجموعة ساي جين . لكنك قلت أنك لا تستطيع
ar	I'm not going to let her go.	. أنا من يمنعها أن ترحل
ar	Since I can't abstain myself from seeing her I'm going to use the engagement as a way of putting some distance between us and then I'm going to continue to see her.	سوف أحافظ علي مسافة بيننا من اجل الزفاف و أيضاً
ar	From what I've seen for myself, that Bang Shil isn't your average girl.	أن بونج سيل " جونج سيل " ليست فتاة عادية
ar	When she saw the vase that you received as your engagement gift she looked at your aunt straight in the eyes, and told her that she was going to break it.	أخذت هدية الخطوبة . قالت أن عليك كسرها أمام عمتك
ar	We received that as an engagement gift for Joong Won's upcoming marriage.	قامت عائلتها بـ إرسالها
ar	You're arrogant and rude.	. أنا لست من النوع الذي سيظل صامت
ar	I thought I told you that the vase must be broken?	. ألم أقل إنكِ يجب أن تكسريها
ar	Are you saying you'll do whatever you can to break up Joong Won's engagement? It's too dangerous for him.	هل أنتِ تقولين بإنكِ سوف تفعلين أي شيء لـ منع زواج جونج وون ؟
ar	So, I'm going to do whatever I can to break it.	. هناك شخصاً ما سوف يقع بـ مشاكل بسببها . يجب أن نكسرها
ar	You need to be very careful.	. أحترس
ar	That woman boasted her intention to us, and you broke that vase yourself... and you ultimately broke off the engagement.	كسرت الزهرية . و قمت بألغاء الزفاف
ar	It seem like I've played a very dangerous game with her.	. لقد كنت أتصرف بطريقة خطيرة حقاً
ar	Anyways, you fell totally head over heels for her.	. لقد وقعت في الحب لهذه الدرجة
ar	So, are you going to start over again with her?	هل يمكنني أن أشرب الآن ؟
ar	Your belly.	هذه المعدة
ar	I've heard enough, you may go now.	لذلك أرحل
ar	Since I just simply relayed the things I've heard objectively over to you... you can figure out the subjective interpretation however you want.	بما أني أخبرتك شيء الجميع يعلمه بالفعل . الوحيد الذي يعرف الحقيقة و التفاصيل هو أنت
ar	If it was memories of me toying with her when I wasn't being myself... then it's a good thing...	إذا كنتِ مجرد ذكري و أنا لم أكن افكر جيداً حينها
ar	that it's gone.	. من الجيد أني نسيتكِ
ar	In time like this, it would be so nice if I could have a drink myself.	. في مثل هذا الوقت أشعر بـ رغبة في شرب بعض الكحول
ar	Do you know what upsets me the most about my ability?	هل تعرف ما هو أسوء شيء في رؤية الأشباح ؟
ar	Because I'm too afraid, I can't even drink a sip of alcohol.	. لا يمكنني أن أشرب لأني خائفة أن يتم اخذ جسدي
ar	President Joo acted as your defense shield, right?	. الرئيس كان درعكِ
ar	It sounds like you could've done anything you wanted as long as you were with him.	كان يمكنكِ فعل بأي شيء
ar	Are you sure that you'll be alright without him?	هل أنتِ متأكدة انكِ بخير بدونه ؟
ar	It is a little disappointing.	. أعتقد أن الأمر سيء للغاية
ar	It would've been so nice if I could've... held his hand and had a beer while I was still with him.	كان الأمر سيكون جيداً أذا ....... أمسكنا أيدي بعضنا البعض و شربنا الكحول
ar	I'm worried about you.	. أنا قلق
ar	You lived your life in hiding out of fear until you met President Joo.	عشتِ و أنت خائفة من الأشباح
ar	I'm worried that you'll go back to living your life that way.	. أخشي أن تعودي للعيش هكذا
ar	I... saw the scariest spirit I've ever seen in my life at the hospital that day.	. رأيت أكثر شيء مرعب في المشفي
ar	I've never been more afraid of anything in my life.	. لم أكن بهذا الخوف من قبل
ar	I'm never going to use him as a shield and drag him into my world ever again.	. أنا لن أسحبه إلي عالمي مجدداً و أكون سعيدة لـ رؤيته
ar	Compared to what I saw that day, none of those other ghosts even scares me.	الأشباح الآخري ليست مخيفة
ar	I can handle it.	. يمكنني تحملها
ar	President Joo lost his memories... but you're alone with all your feelings and pain... that really upsets me.	أشعر بالآسف علي ضياع ذكريات الرئيس جو لكن عليكِ أن تتماسكي و تخفي مشاعركِ في قلبكِ . و تتحملي كل شيء لوحدكِ
ar	I told you that I've kept my heart locked up in a seal.	. أخبرتك بالفعل أني قمت بـ الأغلاق علي مشاعري
ar	It's only right that I have to deal with all this myself.	. لهذا كل شيء أنا حسبته صحيح
ar	When I got stabbed on my back...	..... هل تم طعني
ar	I wonder if the stab went all the way through to here?	حتي هنا ؟
ar	Something feels empty.	. أشعر بالفراغ
ar	I feel like I gave it to that woman but she said that I threw something away during the time that I spent with her.	لكنها تقول إنني لم أفعل و إننا كنا نتسلي فقط
ar	Don't ever... go back there to retrieve it.	. لا تلتصق بي مجدداً
ar	Don't worry about me.	. لا تقلق علي
ar	I'm never going back to live in hiding like I used to.	. أنا لن أعيش بتهور بعد الآن
ar	I'm thinking about going back to school next year.	. أفكر في العودة للـ الدراسة في العام القادم
ar	I'm comfortable enough now to even ask a ghost for an answer to a test.	. أعتقد إنني وصلت لـ مرحلة حيث أستطيع أن أسأل الشبح الذي بجانبي عني الإجابات
ar	I guess you won't have any problems climbing to the top of your class.	. أعتقد إنكِ لن تواجهي أي مشاكل بأن تصبحي المركز الأول علي الصف
ar	I was always at the top of my class.	. لقد كنت دائماً الأولي في الصف في الثانوية
ar	- Are you bragging right now?	هل تتفاخرين ؟
ar	I won every single award out there... and I really was a pretty amazing person to be reckoned with.	لقد . كنت أستعد ان اكون شخص ناجح و مشهور
ar	Then... don't ever give up, and become someone truly amazing.	لا تستلمي و صيري شخص . مشهور و ناجح في الحياة
ar	When you do, I'll become your bodyguard.	. و بعدها سأحميكِ
ar	I, myself, am quite amazing in my abilities to protect someone.	جيد في حماية الناس
ar	Your abilities to guard is at the Blue House level, right?	. أنت ماهر لدرجة كافية للعمل في البيت الأزرق * البيت الأزرق :
ar	If I'm to ask you to be my bodyguard...	أذا طلبت أن تحميني
ar	I guess I'll need to become the president of this nation or something.	. يجب أن أكون جيدة و ناجحة مثل الرئيس
ar	I'll protect you even if you're just a local minor chairman.	. سأحميكِ حتي أذا لم تكوني الرئيس
ar	Let's cheers to that.	. نخبكِ
ar	Let's both become amazing people.	. لنصبح أشخاص ناجحين و رائعين
ar	Hey. You have your coffee right here.	تلك القهوة لك
ar	Why are you asking me for my soda?	. و هذه الصودا لي
ar	There's a kid who always comes around and asks me to get him coffee.	. هناك طفل يأتي إلي هنا من أجل قهوة مجانية
ar	Kang Woo... does it frighten you to know that there's a ghost sitting here?	هل أنت خائف من الأشباح التي هنا ؟
ar	No, not at all.	. لا
ar	I've gotten much braver now.	لقد تخطيت خوفي بطريقة ما
ar	I need to make some changes so that I will be able to protect you.	حتي أصبح شخصاً يستطيع حمايتكِ
ar	Cheers... to you too.	. نخبك أنت ايضاً . نخبك
ar	Studying came so easily to 'Big Sun'.	. الدراسة كانت أسهل شيء للـ الشمس الكبيرة
ar	I'm sure I'll be able to pick up right where I left off.	. أنا متأكدة أني سأستطيع القيام بعمل جيد مجدداً
ar	If you truly care about Joong Won...	أليس كذلك ؟
ar	then lend me your body.	. دعيني أستعير جسدكِ
ar	But she hasn't come back to ask me again.	. لم تأتي مجدداً لـ تتوسل لي مجدداً
ar	It seems as though he's regained his consciousness... and is doing rather quite well.	أعتقد أنه استيقظ جيداً . و كل شيء علي ما يرام الآن
ar	I really appreciate the help you gave me.	. أنا حقاً ممتنة علي مساعدتكِ له
ar	And what of his memories?	......
ar	His memories are sealed in there.	ذاكرته لكن
ar	But, I see that you haven't return it to him.	أنتِ لم تعيديها له ؟
ar	That would make you meaningless to him.	هذا يعني إنكِ لا تريدينه أن يتذكرك
ar	I purposely didn't given it back to him because that's what I wanted.	. بسبب هذا لن أعيدها له
ar	Well, that's up to you to decide.	أفعلي ما تريدين
ar	You haven't forgotten our deal, have you?	أليس كذلك ؟
ar	What is it that I need to do?	ماذا يجب أن أفعل ؟
ar	I think it would be better for you to let go of trying to live an ordinary life.	. اعتقد أنه من الافضل لكِ ان تنسي حياتكِ العادية
ar	I need you to... gather the spirits of dead young women for me.	عليكِ . أن تجمعي النساء العازبات و المتوفيات لي
ar	I'm a marriage matchmaker for the dead.	و أنا . سأبحث لهم علي الرجال المناسبين
ar	I'm lacking the young women I need to offer up as mates to my clients these days.	هناك نقص في . النساء المناسبين للزواج
ar	Go to the places where spirits wander... and bring back some useful and potential brides.	.... أذهبي لـ زيارة مكان تحوم فيه الأرواح و أجمعي عرائس مناسبات
ar	Excuse me.	. مرحباً
ar	By any chance... is there anyone here who's never been married?	هل يوجد أحد هنا لم يتزوج بعد ؟
ar	Anyone who'd like to come with me? Are there any... young unmarried women here?	هل يوجد من يرغب في المجيء معي ؟ هل يوجد هنا شبح فتاة لم تتزوج هنا ؟
ar	By any chance... are you single?	.... هل أنتِ ربما عازبة ؟
ar	Miss!	! آنسة ! آنسة
ar	If you never got the chance to get married before you passed away... would you be interested in getting married?	.......... إذا كنتِ عازبة قبل أن تموتي هل تخططين للزواج الآن ؟
ar	For the rest of your life, as long as I need you... you're going to gather up the spirits that I need.	حتي و لو للأبد ستقومين للأبد . بجمع و أحضار الأرواح لي
ar	That's the deal you made with me in order to save that man's life.	مقابل انقاذ حياته . هذا هو الأتفاق الذي قمتي به معي
ar	Want to come with me?	. سأذهب فقط
ar	I don't want to go to America to shoot a movie.	. أنا لا أريد تصوير فيلم في الولايات المتحدة
ar	Do you know what a great opportunity this is?	هذه فرصة رائعة !
ar	It's with the famed movie director, Peter Jason!	المخرج هو بيتر جاكسون * lord of the rings مخرج
ar	I can't act.	. لا أستطيع التمثيل
ar	Can't that director tell just by looking at me?	ألا يمكنك أخبار المخرج إنني لا أستطيع التمثيل ؟
ar	This role just requires a pretty face with a nice body.	. الدور يحتاج فقط إلي وجه جميل و جسد مناسب
ar	This role can make you internationally famous like all those Bond girls.	ستكونين مشهورة مثل الأجانب
ar	Let's tell him that you'll take the role.	. لنخبرهم أنكِ ستقومين بهذا
ar	Are you trying to get me away from Kingdom?	هل تحاولين أن تبعديني من المملكة بأي طريقة ؟
ar	Nice try.	. لابد إنكِ بذلتي مجهود كبير
ar	- Let's just go there for a year.	. فقط لنبقي في الخارج لـ عام
ar	- I'll think about it.	. سأفكر في الأمر
ar	That's Tae Gong Shil.	. أنها تاي جونج سيل
ar	Who's that witch looking woman sitting next to her?	من هذه الساحرة الشريرة ؟
ar	It looks like she's introducing Gong Shil to the elders sitting in front of them.	. أعتقد إنها تعرفها علي أحداً ما
ar	A potential bride who may be very suitable for your son... has been found by this woman sitting next to me.	..... عروسة جيدة و ستكون مناسبة لـ أبنكم . وجدتها هذه الفتاة التي أمامكم
ar	Do you think that she'd help my Seung Won...	أبننا سيونج وون
ar	feel less lonely in his afterlife?	أليس كذلك ؟
ar	Kang Woo.	. كانج وو
ar	I may have to move to America to film a movie.	. أنا قد أذهب إلي أمريكا لـ تصوير فيلم
ar	I've seen the movie that you were in... and you sucked at acting.	لتذهبي إلي هناك
ar	But I have the body and the looks.	. لدي جسد مثالي ووجه جميل لـ ينجح كل شيء
ar	You saw my movie?	. هل رأيت فيلمي ؟
ar	- I thought you said you never saw it.	لقد قلت أنك لا تعلم
ar	- It was showing on TV. Ah.	. لقد كان معروضاً علي التلفاز مجاناً - ......
ar	That movie was a melodrama.	أجل - لأن هذا كان رومانسي و درامي
ar	My acting was bad because that role required crying which is totally unsuitable for me.	و هذه ليست شخصيتي مطلقاً
ar	I hate crying.	. اكره أن أبكي
ar	I agree. Crying really doesn't suit you.	البكاء لا يناسبكِ
ar	Seeing you cry put me in a really bad mood.	. رؤيتكِ تبكين جعلتني أشعر بأحساس سيء !
ar	Is that the only way you can express it? That it put you in a bad mood? What a crass way of putting it.	تعليقك علي الفيلم هو " جعلك تشعر بأحساس سيء " هذا يبدو كـ تعليق شخصي
ar	Anyways, take some acting classes and become an amazing international actress.	تدربي علي تمثيلكِ و صيري ممثلة دولية و أنجحي
ar	You're already cool, so I'm sure you'll do well.	. انتِ رائعة لذلك ستقومين بعمل جيد
ar	Want to be a personal bodyguard... for an international star?	ألا ترغب في أن تصبح حارس لـ " نجمة دولية " ؟
ar	That really would be an honor. But...	لكن
