ar	en	ar
ar	These are the members of my research team. From the left, this is Koichi Kaga,	هؤلاء هم أعضاء فريق البحث، من اليسار (كاجا كويشي)،
ar	Jun Sanada, and Riko Nirasaki.	(سانادا جون)، و(إيراساكي ريكو).
ar	And these are the X-Men.	وهؤلاء فريق الـ(إكس مين).
ar	I've heard about what you've done. It's an honor to meet you.	لقد سمعت بما صنعتموه، إنه لشرف لي مقابلتكم.
ar	-That's everyone?	-هل هؤلاء كل الموجودين ؟
ar	Go ahead.	ابدأوا من دوني.
ar	The weather appears to be clearing.	يبدو أن الطقس قد هدأ.
ar	It might be a good time to go check on the Blackbird.	سأذهب لأتفحص الـ(بلاك بيرد).
ar	I'm sorry to trouble you, but could I borrow some tools?	آسف لازعاجك، لكن أيمكنني استعارة بعض الأدوات ؟
ar	-l'll go, too.	-سأذهب معك .
ar	-l'm coming, too.	-سأذهب أيضاً .
ar	You talk to Hisako and Emma.	يمكنك البقاء والتحدث إلى (إيما) و(هيساكو).
ar	The research facility is in the back of this house.	أهناك وسيلة للأبحاث خلف هذا المنزل ؟
ar	The main equipment is underground.	الأجهزة الرئيسية في الطابق الأرضي.
ar	A boy...	ذلك الفتى...
ar	Younger than me...	الأصغر منيّ...
ar	Hisako.	(هيساكو).
ar	You used to go to an ordinary school, right?	لقد كنت ترتادين مدرسة عادية، صحيح ؟
ar	Yeah. I used to come to the Academy after my regular school let out.	أجل، لقد كنت أذهب إلى معهد (ساساكي) بعد إنتهاء المدرسة.
ar	Maybe that boy was a friend of yours at school?	لربما كان ذلك الفتى معك في المدرسة العادية ؟
ar	-Maybe...	-لربما ...
ar	-By the way, Yui.	-بالمناسبة يا (يوي )...
ar	Aren't you an acquaintance of Professor X?	ألاّ تعرفين البروفيسور (إكس) شخصياً ؟
ar	Yes. It was more than 15 years ago, but I did meet him once.	نعم، كان ذلك قبل أكثر من 15 عاماً، لكنني قابلته مرة واحدة فقط.
ar	More than 15 years ago?	قبل أكثر من 15 سنة ؟
ar	But we were never close.	لكننا لم نكن مقربين جداً،
ar	It was such a long time ago, I don't really remember.	كان ذلك منذ زمن بعيد، لا أتذكر ذلك حقاً.
ar	I have to go to a meeting, so please make yourselves at home.	لديّ اجتماع عليّ حضوره، المعذرة، يجب أن أنصرف.
ar	If you need anything, you can reach me on this intercom.	إن احتجتم لأي شي، اتصلوا عليّ بواسطة "الأنتركم".
ar	I feel like Dr. Sasaki's changed.	أشعر بأن الدكتورة (ساساكي) متغيرة.
ar	Changed?	متغيرة ؟
ar	Yeah. She used to be kinder and warmer, I think.	أجل، اعتادت أن تكون لطيفة وأدفأ، كما أظن.
ar	She still seems kind, at least to me.	لا زالت تبدو كذلك، بالنسبة لي على الأقل.
ar	That's true, but...	ذلك صحيح، لكن...
ar	Yui Sasaki is lying.	(يوي ساساكي) تكذب.
ar	She said she hasn't seen Professor X in 15 years.	قالت بأنها لم ترى البروفيسور (إكس) منذ 15 عاماً.
ar	But she has seen him since then.	لكنها قد رأته أثناء ذلك.
ar	Did you read her mind?	هل قمت بقراءة عقلها ؟
ar	It's because of things like that that people hate mutants.	بسبب أشياء كهذه البشر يكرهون المتحولين.
ar	No. I didn't use telepathy.	كلا، أنا لم أستخدم التخاطر.
ar	This is a woman's intuition, right?	إنه حدس امرأة، أليس كذلك ؟
ar	A woman's intuition?	حدس امرأة ؟
ar	When we mentioned the Professor, she called him "Charles."	عندما ذكرنا البروفيسور، دعته بـ"(تشارلز)".
ar	Even though they weren't that close.	بالرغم من أنهما ليسا مقربين.
ar	Some people use first names even with people they're not friendly with.	بعض الناس يستخدمون الأسماء الأولى حتى مع الناس الغير مقربين منهم.
ar	But she had asked you if Professor X was planning on coming.	لكنها سألتك إن كان البروفيسور (إكس) يخطط للمجيىء.
ar	Yui Sasaki is involved with Professor X on a much deeper level.	(يوي ساساكي) والبروفيسور (إكس) لديهما علاقة على مستوى أعمق.
ar	A deeper level...	مستوى أعمق...
ar	-All right, let's pull it out!	- حسناً، لنسحبها !
ar	-That's impossible.	-ذلك مستحيل .
ar	Storm!	(ستورم) !
ar	Could you melt all this ice?	أيمكنك إذابة الثلج ؟
ar	That's also impossible. Look at this snow.	ذلك مستحيل أيضاً، انظرا إلى هذا الثلج.
ar	I wonder if you could even call it snow.	أتسائل إن أمكنني أن أدعوه بثلج حتى.
ar	At first glance, it seems like snow, but...	-للوهلة الأولى، بدا كالثلج، لكن ...
ar	It doesn't melt. It's not even cold.	-إنه لا يذوب، وليس بارداً حتى .
ar	It seems more like a mineral.	يبدو أشبه بالمعدن.
ar	So in Japan they have diamond or ruby snow?	أهذا يعني أنها تثلج ياقوتاً أو ماساً في (اليابان) ؟
ar	Of course not.	بالطبع ليس كذلك.
ar	It's as ifjust this place was suddenly changed.	كما يبدو أن هذا المكان قد تغير فجأة.
ar	At any rate, there's nothing we can do like this.	على أية حال، لا يمكننا فعل شيء كهذا.
ar	I'll contact Charles and have him send a spare Blackbird.	سأتصل بـ(تشارلز) ليرسل لنا الـ(بلاك بيرد) الاحتياطي.
ar	Yui Sasaki?	(يوي ساساكي) ؟
ar	Yes, I thought I'd let you know, just in case.	أجل، ظننت بأنه يجب أن تعرف، تحسباً.
ar	Understood. ln any event, I'll send you the backup jet at once.	مفهوم، على كل حال، سأرسل لك طائرة الاسناد.
ar	-It's been a while.	-لقد مضت فترة .
ar	-Yui.	-يوي) ).
ar	I wasn't expecting you to contact me.	لم أكن أتوقع بأنك ستتصلين بي.
ar	From the sound of it, you've already heard a report about me.	يبدو من صوتك أنك حصلت على تقرير عني.
ar	I hear you've shut down the Academy.	سمعت بأنك قد أغلقت الأكاديمية.
ar	Let me just state my business. I want to continue my research here in peace.	دعني أتولى أعمالي، أنا بحاجة للاستمرار بأبحاثي هنا في سلام.
ar	Are you saying the X-Men are in the way?	أتقولين بأن الـ(إكس مين) يعترضون الطريق ؟
ar	I'll help if needed. But I want them out of here as soon as the investigation is over.	سأساعدهم إن احتاجوني، لكنني أريدهم خارج هذا المكان ريثما أنتهي من التحقيق.
ar	would something be disturbed if they stay too long?	أستكون هناك مشكلة إذا بقوا لفترة أطول ؟
ar	It may be the key to solving the string of mutant occurrences around your lab.	السر وراء حوادث المتحولين قد تقع بالقرب من مختبر أبحاثك.
ar	I have nothing to do with it.	ليس لي علاقة بذلك.
ar	I'm not so sure about that. When I sent my mind to Tohoku,	أنا لست متأكداً بشأن ذلك، عندما أوجه عقلي نحو (توهوكو)،
ar	I saw you and a boy.	أراك مع فتى صغير.
ar	I couldn't see his face, but you overlapped with him.	لم أستطع رؤية وجهه، لكنك كنت متداخلة معه.
ar	Does that boy have anything to do with you?	هل لديك أية علاقة مع ذلك الفتى ؟
ar	Why did he enter my mind?	لماذا كان يدخل إلى عقلي ؟
ar	Answer me, Yui.	أجيبيني يا (يوي).
ar	That boy is probably Takeo.	من المحتمل أن ذلك الفتى هو (تاكيو).
ar	Takeo?	(تاكيو) ؟
ar	He's my son. Mine...	إنه ابني، ولدي...
ar	And yours.	وولدك.
ar	Our son?	ولدنا ؟
ar	You're telling me I have a son?	أتخبريني بأن لديّ ابن ؟
ar	So then that was...	إذاً كان ذلك...
ar	My son entered my consciousness.	ابني الذي دخل عقلي.
ar	That is incorrect.	ذلك خاطىء.
ar	If you say you saw him, then you just happened to look in my mind.	إن قلت أنك رأيته، إذن فقد رأيت صورته في عقلي.
ar	But I'm certain I met that boy.	لكنني متأكد أنني قابلت ذلك الفتى.
ar	You said you couldn't see his face. That's natural.	لقد قلت بأنك لا تستطيع رؤية وجهه، ذلك طبيعي.
ar	Because Takeo is already gone.	لأن (تاكيو) لم يعد هنا بالفعل.
ar	Do you mean our son is dead?	أتعنين أن ابننا قد مات ؟
ar	Someday I'll tell you everything.	يوماً ما، سأخبرك كل شيء.
ar	But for now, please stop meddling in my affairs.	ولكن الآن، من فضلك توقف عن التدخل في شؤوني.
ar	Staying here is pointless.	لا فائدة من البقاء هنا.
ar	In the meantime, let's go back to the Sasaki house.	في أثناء ذلك، دعونا نعود إلى منزل (ساساكي).
ar	An avalanche?	إنهيار جليدي ؟
ar	Doesn't seem like it.	لا يبدو مثله.
ar	is a mountain monster making snowmen or...	إنه متحول متوحش يصنع رجل ثلج أو...
ar	What on earth is that?	ما ذلك بحق الأرض ؟
ar	It seems that snowman has business with us.	يبدو أن رجل الثلج ذلك لديه عملاً معنا.
ar	So let's go say hello!	إذاًدعونانرحببه!
ar	-What's that?	-ما هذا ؟
ar	-Storm.	-ستورم) ).
ar	There's one here, too.	هناك واحد هنا، أيضاً.
ar	Greetings, ladies and gentlemen of the X-Men.	تحياتي يا سيدات وسادة الـ(إكس مين).
ar	How do you like Japan?	كيف وجدتم (اليابان) ؟
ar	It's not bad. The food is good and the scenery's nice.	ليست سيئة، الطعام جيد والمناظر لطيفة.
ar	Then you'll have no regrets when I kill you here!	إذنلنتتأسفواإنقمتبقتلكمهنا!
ar	Sorry, but I haven't seen any Kabuki yet.	متأسف، لأنني لم أرى الـ"كابوكي" بعد.
ar	Some kind of hedgehog monster?	نوع من القنافذ المتوحشة ؟
ar	Beast!	(بيست) !
ar	Did you pulverize him?	هل قمت بسحقه ؟
ar	There was no resistance.	لم تكن هناك مقاومة.
ar	You are pretty tough.	كما توقعت، أنت قاسي جداً.
ar	So that was the aim of the attack just now.	إذاً كان هذا هدفك من ذلك الهجوم.
ar	The greetings are finished. Let's meet again.	لقد انتهينا من التعارف، دعونا نجتمع ثانية.
ar	I see. He can liquefy his body.	فهمت، يمكنه أن يذوب جسده.
ar	That's why he offered no resistance.	لهذا السبب لم يبدي المقاومة.
ar	This is no time for analysis!	ليسهذاوقتالتحليل!
ar	Let's get out of here!	عليناالخروجمن هنا!
ar	Jun?	(جون) ؟
ar	I'm going to take my shot in my room.	سآخذ حقنتي في غرفتي.
ar	Make sure the X-Men don't see you.	تأكد بأن الـ(إكس مين) لن يروك.
ar	-Be careful.	-كن حذراً .
ar	-l understand.	-أنا أتفهم .
ar	Hisako?	(هيساكو) ؟
ar	is something wrong with your right hand?	أيوجد خطب ما بيدك اليمنى ؟
ar	The bruise on my hand is hurting.	الكدمة على يدي تؤلمني.
ar	Bruise?	الكدمة ؟
ar	It used to be bigger.	كانت أكبر.
ar	-Do you remember an injury or a burn?	-أتذكرين أي جرح أو حرق ؟
ar	Mom and Dad also say they don't remember it, so I thought it was just a birthmark.	أمي وأبي قالا بأنهما لا يتذكراها، لذا ظننت بأنها مجرد وحمة.
ar	It suddenly started hurting when I got here.	فجأة بدأت تؤلمني عندما وصلت هنا.
ar	-Has it ever hurt you like this before?	ألم تؤلمك من قبل أبداً ؟
ar	-l don't think so.	لا أظن ذلك.
ar	That's strange, I wonder if something irritated it.	ذلك غريب، أتسائل إن كان هنالك شيء ما أثارها.
ar	-l'm going to ask Dr. Sasaki for an ointment.	-سأسأل الدكتورة (ساساكي) عن مرهم .
ar	-Hey!	- مهلاً !
ar	-She told us to use the intercom, remember?	لقد أخبرتنا أن نستعمل "الأنتركم"، أتذكرين ؟
ar	-It's all right. It's not as if she's going outside.	ذلك صحيح، ليس وهي في الخارج.
ar	This is a good opportunity. I need to talk to you.	هذه فرصة جيدة، أريد الكلام معك.
ar	Talk?	الكلام ؟
ar	blackbird auto-piIot engaged. Launch preparations complete.	تم تشغيل القيادة الآلية للـ(بلاك بيرد)، التحضيرات جاهزة للانطلاق.
ar	You want me to let you read my mind?	أنت تريدين أن أسمح لك قراءة عقلي ؟
ar	-What for?	-لأجل ماذا ؟
ar	To remove your hesitation.	لإزالة ترددك.
ar	My hesitation?	ترددي ؟
ar	I heard you couldn't fight the berserk mutant at the U-Men base and almost lost your life.	سمعت بأنك ترددت في مواجهة المتحول الهائج في قاعدة الـ(يو مين)... واقتربت من فقدانك لحياتك...
ar	is it because of Jean?	، أهذا بسبب (جين) ؟
ar	The Professor proved I had nothing to do with Jean's death.	لا علاقة لي بموت (جين) والبروفيسور أثبت ذلك.
ar	So what is making you suffer?	ما الذي يزعجك، إذن ؟
ar	Hisako also asked me. "Help him," she said.	(هيساكو) طلبت مني، "ساعديه" قائلة.
ar	It's none of her business.	ذلك ليس من شأنها.
ar	She's worried about you in her own way.	إنها قلقة بشأنك بطريقتها الخاصة.
ar	And I also don't want a leader who's so hesitant.	وأنا أيضاً لا أريد قائداً يكون متردداً جداً.
ar	At this rate, it may impede our work as X-Men.	في هذا المعدل، ربما سيعرقل عملنا كـ(إكس مين).
ar	Face your heart.	واجه قلبك.
ar	I'm sure Jean would wish for that, too.	أنا متأكدة بأن (جين) تود ذلك أيضاً.
ar	-l don't like this.	-أنا لا أحب هذا .
ar	-What's wrong?	-ما الأمر ؟
ar	Yui Sasaki said she introduced us to everyone in the mansion.	(يوي ساساكي) قالت بأنها عرفتنا على جميع من في القصر.
ar	But I can still smell someone else in there.	لكنني ما زلت أشم رائحة شخص آخر هناك.
ar	Indeed. She doesn't seem to want us there.	بالفعل، لم يبدو أنها تريدنا هناك.
ar	Yui Sasaki's presence at the center of the mutant phenomena and the appearance of the U-Men seems a bit too much for coincidence.	هناك أكثر من مجرد صدفة بأن يظهر كل من (يوي ساساكي)... والـ(يو مين) في مكان حدوث... ظواهر المتحولين.
ar	Seems we'd better keep an eye on Yui Sasaki.	يبدو من الأفضل أن نراقب (يوي ساساكي).
ar	That's why I asked Scott and Emma to stay.	لهذا طلبت من (سكوت) و(إيما) البقاء.
ar	Scott. The X-Men are a light for mutants.	(سكوت)، الـ(إكس مين) هم الضوء المشرق للمتحولين.
ar	I want to become that light.	أريد أن أكون ذلك الضوء.
ar	And I want to continue shining a light on the future for human and mutant children.	أن أكون ذلك الإشراق الذي ينزل على مستقبل كل البشر والأطفال المتحولين.
ar	I'm begging you, Scott. kill me.	أرجوك يا (سكوت)، اقتلني.
ar	You know I couId never do thatI	أنتتعرفينبأنيلنأقوم بذلك !
ar	What did you do to Jean's heart?	أنتمن يتحكمبعقل(جين !
ar	I love you, Scott...	أنا أحبك يا (سكوت)...
ar	Now you die, too.	ستموت الآن، أيضاً.
ar	Dr. Sasaki?	دكتورة (ساساكي) ؟
ar	-Feeling better?	-أتشعر بتحسن ؟
ar	The shadow you saw behind Jean, it's natural that you'd think it was me.	الظل الذي رأيته خلف (جين)، من الطبيعي أن تظنه أنا.
ar	I was attacked by myself. What on earth was that?	لقد هاجمت نفسي، ما كان ذلك بحق الأرض ؟
ar	That must have been your subconscious, the part of your mind where you can't forgive yourself for not saving Jean.	لا بدّ أن ذلك كان لا شعورياً، جزء من عقلك يشعرك بالذنب لعدم تمكنك من انقاذ (جين).
ar	I... tried to escape my inability to save Jean by blaming you for her death.	أنا... كنت أهرب من حقيقة أنني لم أتمكن من إنقاذ (جين) بالتركيز على فكرة بأنك قتلتها.
ar	You're right, the one person I can't forgive is myself.	أنت محقة، الشخص الذي لا يمكنني مسامحته... هو نفسي.
ar	Now that I know you had nothing to do with Jean's death, what should I do?	الآن وقد علمت بأنك لم تشتركي في مقتل (جين)، ماذا عليّ أن أفعل ؟
ar	One year ago, if I'd been there when Jean went berserk, I might have been able to save her.	لو كنت هناك قبل عام عندما أصبحت (جين) هائجة، لربما تمكنت من إنقاذها...
ar	And you, as well.	وأنت كذلك.
ar	Listen to me, Scott.	استمع لي يا (سكوت).
ar	Aren't you the one who taught Hisako that an X-Man's most important quality is his heart?	ألست أنت من علم (هيساكو) كيف تعيش وتصبح عضواً في الـ(إكس مين) ؟
ar	You need a stronger heart than anyone else.	يجب أن يكون قلبك أقوى من أي شخص آخر.
ar	Don't let Jean's will go to waste.	لا تدع إرادة (جين) تذهب سدىً.
ar	I want to become that light. And I...	أريد أن أكون ذلك الضوء.
ar	I want to continue shining a light on the future for human and mutant children.	أن أكون ذلك الإشراق الذي ينزل على مستقبل كل البشر والأطفال المتحولين.
ar	So now you want to coach me, just like Hisako?	إذاً الآن أنت تخططين لإعطائي دروساً، مثل (هيساكو) ؟
ar	The beast that suddenly appeared in the lab turns out to have an unexpected identity.	وحش يظهر فجأة من المختبر، تحول في الأدوار إلى هوية غير متوقعة.
ar	Amid the confusion, Emma becomes suspicious of Yui Sasaki's assistant Jun.	وسط الارتباك، (إيما) يصيبها الشك بشأن (جون) مساعد (يوي ساساكي).
ar	meanwhile, danger approaches Professor X as he flies to Tohoku from New York on the blackbird.	وفي الوقت نفسه، خطر يقترب من البروفيسور (إكس). متوجهاً إلى (توهوكو) قادماً من (نيويورك) على متن الـ(بلاك بيرد).
ar	A new facet of the case is revealed.	الوضع يأخذ منعطفاً غريباً.
ar	Next time on X-Men.: Lost	في الحلقة التالية من (إكس مين) بعنوان: "الضــياع".
ar	♪ Ole, ole, ole, ole... ♪	♪ Ole, ole, ole, ole...
ar	Get in the car!	إدخل الى السيارة
ar	I'm the man whose money you took.	أنا الرجل الذي أخذتم أمواله
ar	He'll get done, sooner or later.	سوف يقوم بإنجازها ، عاجلاً أم آجلاً
ar	I made a call.	لقد أجريت إتصال
ar	There's one thing nobody can escape from, it don't matter how big a master criminal you are.	هنالك شي واحد لا أحد يستطيع الهرب منه it don't matter how big a master criminal you are.
ar	The VAT man.	The VAT man.
ar	Well done on bringing us the money.	أحسنتم في إحضار الأموال لنا
ar	Welcome to Morocco.	أهلاً بكم في المغرب.
ar	For your own sake, I suggest you answer these questions truthfully.	من أجل مصلحتكم , أقترح عليكم أن تجيبوا على هذه الأسئلة بصدق
ar	Why are you on this boat?	لماذا أنتم على هذا القارب ؟
ar	That's... er...	هذا ... آ...
ar	That's all of us going on a fishing trip.	That's all of us نحن في رحلة صيد !
ar	I remember that day... happy times.	أنا أتذكر ذلك اليوم... أوقات مرحة
ar	You are putting a bag in the car.	أنت تضع حقيبة في السيارة ..
ar	What was it?	ماهي ؟
ar	Probably fishing gear.	على الأرجح أنها معدات صيد
ar	Bax?	باكس؟
ar	Tell me about this, please.	أخبروني عن هذا المكان رجاءاً
ar	Where did you learn how to do this?	أين تعلمت القيام بذلك ؟
ar	What is happening here?	ماذا يحدث هنا ؟
ar	That's... that's just lads on holiday, innit?	هذا .. إنهم الفتيان في النزهة
ar	You know, things get a bit out of control.	كما تعلم ، الأمور تخرج عن السيطرة أحياناً
ar	You all OK?	هل جميعكم بخير؟
ar	They... shaved me.	لقد... حلقوني.
ar	And they bust my new glasses.	وحطموا نظاراتي الجديدة
ar	Said Morocco, didn't they?	قال المغرب ، اليس كذلك؟
ar	Yeah, I know that.	نعم ، أنا أعرف ذلك
ar	Did they show you the pictures?	هل أروك الصور ؟
ar	What pictures?	أي صور ؟
ar	What do you say to 'em Rick?	ماذا قلت لهم ريك ؟
ar	Nothing. Obviously. Don't tell them anything, all right.	لا شيء واضح - لاتخبروهم اي شي حسناً -
ar	Not until we get some kind of legal representation.	ليس حتى أن نحصل على التمثيل القانوني
ar	Someone from the embassy - Amnesty or someone.	شخص من السفارة أو عفو من شخص ما
ar	How you gonna get in touch with them?	كيف ستتواصل معهم ؟
ar	Who are they anyway?	من هم بأية حال ؟
ar	They're some kind of militia or something, aren't they?	إنهم نوع من الميليشيا ، أليسوا كذلك ؟
ar	They knew we had that money. They picked us off.	كانوا يعرفون أن الأموال بحوزتنا ،
ar	They're probably using the money for some extremist movement.	على الأرجح أنهم يستخدمون الأموال لبعض الأعمال المتطرفة.
ar	So now we're funding terrorists.	إذاً نحن الآن نمول الإرهابيين
ar	Oh, great. This just gets better and better.	أو ، رائع ، الأمور تزداد سوءاً
ar	He was wearing a shirt, with a Marks and Spencer's label on.	لقد كان يرتدي قميصاً, مع علامات وملصق سبينسر عليه.
ar	I saw it sticking out.	I saw it sticking out.
ar	My interrogator.	المحقق الذي حقق معي.
ar	I mean, extremists...	أقصد المتطرفين
ar	They don't shop at MS, do they?	إنهم لايتسوقون في مارك و سبينسر ، هل هم ؟
ar	Shall we go and help him?	هل يجب أن نذهب ونساعدهم؟
ar	Best not to get involved.	من الأفضل أن لا نتورط
ar	You all right, mate?	You all right, mate?
ar	Serious. It's a bird!	حقاً ، إنه طائر
ar	Uh! Argh!	أوه
ar	I was just trying to see if you were OK.	كنت فقط أحاول أن أتاكد أنك بخير
ar	I'm Quinn.	أنا كوين
ar	What sort of fag name is that?	What sort of fag name is that?
ar	Dunno. Ask my dad.	لا أدري ، إسألي أبي
ar	Named after my grandfather, I think.	لقد سميت على اسم جدي على ما أعتقد
ar	I'm Mercedes. Hi.	أنا مرسيدس ، مرحبا
ar	- Your dad into cars then?	- والدك يعمل في في السيارات إذاً ؟
ar	- Heard of the Count of Monte Cristo, dumb fuck?	- هل سمعت برواية "كونت دي مونت كريستو" ؟
ar	Yeah... no... yeah - fuck, I dunno, I can't remember.	نعم .. لا .. نعم ..
ar	Um... uh...	Um... uh...
ar	Can I just ask, what's with all the rough stuff?	هل بإمكاني أن أسأل ماذا كل المواد الخام ؟ 73 00: 07:
ar	It's what they do if you don't tell them what they want.	27,935 هذا مايفعلونه في حال لم تخبرهم مايريدون من يكونوا ؟
ar	A bunch of COCKSUCKERS! Come on!	مجموعة من الملعونين
ar	Do you have any idea how we might get in touch with someone from the British Government?	هل لديك أي وسيلة ربما نستطيع التواصل بها 77 00: 07: 34,655
ar	Yeah, it's easy.	نعم ، إنها بسيطة
ar	It's the Foreign Office.	إنها وزارة الخارجية البريطانية
ar	What is this place exactly?	ما هو هذا المكان بالضبط ؟
ar	It's where they bring people to question... ..when they don't want anyone to know they're doing it.	إنه المكان الذي يجلب فيه الناس للإستجواب ..عندما لا يريدون أن يعلم أحد بما يقومون به .
ar	A week ago, I was standing in line, holding a tuna baguette, queuing up for easyJet.	قبل إسبوع , كنت واقف في الطابور , أحمل ساندويتش تونة يتهاتفون من أجل "إيزي جيت". 88 00:
